{"model":"anthropic/claude-sonnet-4","provider_name":"Anthropic","request_model":"anthropic/claude-sonnet-4","response_model":"anthropic/claude-sonnet-4","input_tokens":1200,"cache_read_tokens":800,"cache_write_tokens":0,"output_tokens":240,"reasoning_tokens":64,"cost_usd":0.0123,"cost_source":"reported","measurement":"metered","ttft_ms":820,"finish_reason":"stop","gen_id":"gen_abc123","attempt":1,"role":"main","effort":"standard"}
